<?xml version="1.0"?>
<!DOCTYPE filter-itk SYSTEM "itk_filter.dtd">

<!--
  The contents of this file are subject to the University of Utah Public
  License (the "License"); you may not use this file except in compliance
  with the License.
  
  Software distributed under the License is distributed on an "AS IS"
  basis, WITHOUT WARRANTY OF ANY KIND, either express or implied. See the
  License for the specific language governing rights and limitations under
  the License.
  
  The Original Source Code is SCIRun, released March 12, 2001.
  
  The Original Source Code was developed by the University of Utah.
  Portions created by UNIVERSITY are Copyright (C) 2001, 1994 
  University of Utah. All Rights Reserved.
-->

<filter-itk name="itk::UnaryFunctorImageFilter">
  <description>
Implements pixel-wise generic operation on one image.
  </description>
  <templated>
    <template>InputImageType</template>
    <template>OutputImageType</template>
    <template>FunctionType</template>
    <defaults>
      <default>itk::Image&lt;unsigned long, 3&gt;</default>
      <default>itk::Image&lt;itk::RGBPixel&lt;unsigned char&gt;, 3&gt;</default>
      <default>itk::Functor::ScalarToRGBPixelFunctor&lt;unsigned long&gt;</default>
    </defaults>
    <defaults>
      <default>itk::Image&lt;unsigned long, 2&gt;</default>
      <default>itk::Image&lt;itk::RGBPixel&lt;unsigned char&gt;, 2&gt;</default>
      <default>itk::Functor::ScalarToRGBPixelFunctor&lt;unsigned long&gt;</default>
    </defaults>
  </templated>

  <inputs>
    <input name="InputImage">
      <type>InputImageType</type>
      <call>SetInput</call>
    </input>  
  </inputs>
  <outputs>
    <output name="OutputImage">
      <type>OutputImageType</type>
      <call>GetOutput</call>
    </output>
  </outputs>

  <parameters>
  </parameters>

  <includes>
    <file>itkUnaryFunctorImageFilter.h</file>
    <file>itkRGBPixel.h</file>
    <file>itkScalarToRGBPixelFunctor.h</file>
  </includes>
</filter-itk>
